{
  "approval_id": "appr-20260724-001",
  "request_id": "req-20260724-002",
  "approved_by": "user",
  "approved_at": "2026-07-24T14:30:00+08:00",
  "operation": "COMMIT_CANON",
  "approved_scope": {
    "files": ["state/canon.md", "state/character_state.md"],
    "items": ["canon-042", "canon-043", "char-state-linyuan-07"]
  },
  "based_on_revision": "rev-canon-42",
  "expires_after_use": true,
  "status": "ACTIVE"
}
